<?xml version="1.0" encoding="UTF-8"?>
<dataroot xmlns:od="urn:schemas-microsoft-com:officedata" xmlns:xsi="http://www.w3.org/2001/XMLSchema-instance"  xsi:noNamespaceSchemaLocation="03m_ActivityMethods.xsd" generated="2025-09-22T19:00:41">
<_x0030_3m_ActivityMethods>
<ID>1</ID>
</_x0030_3m_ActivityMethods>
<_x0030_3m_ActivityMethods>
<ID>3</ID>
<ActivityID>18</ActivityID>
<MethodID>1</MethodID>
</_x0030_3m_ActivityMethods>
<_x0030_3m_ActivityMethods>
<ID>4</ID>
<ActivityID>18</ActivityID>
<MethodID>2</MethodID>
</_x0030_3m_ActivityMethods>
<_x0030_3m_ActivityMethods>
<ID>5</ID>
<ActivityID>18</ActivityID>
<MethodID>3</MethodID>
</_x0030_3m_ActivityMethods>
<_x0030_3m_ActivityMethods>
<ID>6</ID>
<ActivityID>19</ActivityID>
<MethodID>1</MethodID>
</_x0030_3m_ActivityMethods>
<_x0030_3m_ActivityMethods>
<ID>7</ID>
<ActivityID>19</ActivityID>
<MethodID>2</MethodID>
</_x0030_3m_ActivityMethods>
<_x0030_3m_ActivityMethods>
<ID>8</ID>
<ActivityID>19</ActivityID>
<MethodID>5</MethodID>
</_x0030_3m_ActivityMethods>
<_x0030_3m_ActivityMethods>
<ID>9</ID>
<ActivityID>21</ActivityID>
<MethodID>1</MethodID>
</_x0030_3m_ActivityMethods>
<_x0030_3m_ActivityMethods>
<ID>10</ID>
<ActivityID>21</ActivityID>
<MethodID>2</MethodID>
</_x0030_3m_ActivityMethods>
<_x0030_3m_ActivityMethods>
<ID>11</ID>
<ActivityID>21</ActivityID>
<MethodID>3</MethodID>
</_x0030_3m_ActivityMethods>
<_x0030_3m_ActivityMethods>
<ID>12</ID>
<ActivityID>21</ActivityID>
<MethodID>5</MethodID>
</_x0030_3m_ActivityMethods>
<_x0030_3m_ActivityMethods>
<ID>13</ID>
<ActivityID>21</ActivityID>
<MethodID>6</MethodID>
</_x0030_3m_ActivityMethods>
<_x0030_3m_ActivityMethods>
<ID>14</ID>
<ActivityID>22</ActivityID>
<MethodID>5</MethodID>
</_x0030_3m_ActivityMethods>
<_x0030_3m_ActivityMethods>
<ID>15</ID>
<ActivityID>22</ActivityID>
<MethodID>1</MethodID>
</_x0030_3m_ActivityMethods>
<_x0030_3m_ActivityMethods>
<ID>16</ID>
<ActivityID>18</ActivityID>
<MethodID>5</MethodID>
</_x0030_3m_ActivityMethods>
<_x0030_3m_ActivityMethods>
<ID>17</ID>
<ActivityID>24</ActivityID>
<MethodID>1</MethodID>
</_x0030_3m_ActivityMethods>
<_x0030_3m_ActivityMethods>
<ID>18</ID>
<ActivityID>27</ActivityID>
<MethodID>1</MethodID>
</_x0030_3m_ActivityMethods>
<_x0030_3m_ActivityMethods>
<ID>19</ID>
<ActivityID>27</ActivityID>
<MethodID>2</MethodID>
</_x0030_3m_ActivityMethods>
<_x0030_3m_ActivityMethods>
<ID>20</ID>
<ActivityID>27</ActivityID>
<MethodID>3</MethodID>
</_x0030_3m_ActivityMethods>
<_x0030_3m_ActivityMethods>
<ID>21</ID>
<ActivityID>27</ActivityID>
<MethodID>5</MethodID>
</_x0030_3m_ActivityMethods>
<_x0030_3m_ActivityMethods>
<ID>22</ID>
<ActivityID>4</ActivityID>
<MethodID>2</MethodID>
</_x0030_3m_ActivityMethods>
<_x0030_3m_ActivityMethods>
<ID>23</ID>
<ActivityID>4</ActivityID>
<MethodID>1</MethodID>
</_x0030_3m_ActivityMethods>
<_x0030_3m_ActivityMethods>
<ID>24</ID>
<ActivityID>4</ActivityID>
<MethodID>3</MethodID>
</_x0030_3m_ActivityMethods>
<_x0030_3m_ActivityMethods>
<ID>25</ID>
<ActivityID>4</ActivityID>
<MethodID>5</MethodID>
</_x0030_3m_ActivityMethods>
<_x0030_3m_ActivityMethods>
<ID>26</ID>
<ActivityID>31</ActivityID>
<MethodID>1</MethodID>
</_x0030_3m_ActivityMethods>
<_x0030_3m_ActivityMethods>
<ID>27</ID>
<ActivityID>33</ActivityID>
<MethodID>1</MethodID>
</_x0030_3m_ActivityMethods>
<_x0030_3m_ActivityMethods>
<ID>28</ID>
<ActivityID>33</ActivityID>
<MethodID>2</MethodID>
</_x0030_3m_ActivityMethods>
<_x0030_3m_ActivityMethods>
<ID>29</ID>
<ActivityID>33</ActivityID>
<MethodID>3</MethodID>
</_x0030_3m_ActivityMethods>
<_x0030_3m_ActivityMethods>
<ID>30</ID>
<ActivityID>33</ActivityID>
<MethodID>4</MethodID>
</_x0030_3m_ActivityMethods>
<_x0030_3m_ActivityMethods>
<ID>31</ID>
<ActivityID>33</ActivityID>
<MethodID>5</MethodID>
</_x0030_3m_ActivityMethods>
<_x0030_3m_ActivityMethods>
<ID>32</ID>
<ActivityID>33</ActivityID>
<MethodID>6</MethodID>
</_x0030_3m_ActivityMethods>
<_x0030_3m_ActivityMethods>
<ID>33</ID>
<ActivityID>34</ActivityID>
<MethodID>1</MethodID>
</_x0030_3m_ActivityMethods>
<_x0030_3m_ActivityMethods>
<ID>34</ID>
<ActivityID>34</ActivityID>
<MethodID>2</MethodID>
</_x0030_3m_ActivityMethods>
<_x0030_3m_ActivityMethods>
<ID>35</ID>
<ActivityID>34</ActivityID>
<MethodID>3</MethodID>
</_x0030_3m_ActivityMethods>
<_x0030_3m_ActivityMethods>
<ID>36</ID>
<ActivityID>34</ActivityID>
<MethodID>5</MethodID>
</_x0030_3m_ActivityMethods>
<_x0030_3m_ActivityMethods>
<ID>37</ID>
<ActivityID>34</ActivityID>
<MethodID>6</MethodID>
</_x0030_3m_ActivityMethods>
<_x0030_3m_ActivityMethods>
<ID>38</ID>
<ActivityID>34</ActivityID>
<MethodID>4</MethodID>
</_x0030_3m_ActivityMethods>
<_x0030_3m_ActivityMethods>
<ID>39</ID>
<ActivityID>32</ActivityID>
<MethodID>2</MethodID>
</_x0030_3m_ActivityMethods>
<_x0030_3m_ActivityMethods>
<ID>40</ID>
<ActivityID>32</ActivityID>
<MethodID>4</MethodID>
</_x0030_3m_ActivityMethods>
<_x0030_3m_ActivityMethods>
<ID>41</ID>
<ActivityID>32</ActivityID>
<MethodID>1</MethodID>
</_x0030_3m_ActivityMethods>
<_x0030_3m_ActivityMethods>
<ID>42</ID>
<ActivityID>32</ActivityID>
<MethodID>3</MethodID>
</_x0030_3m_ActivityMethods>
<_x0030_3m_ActivityMethods>
<ID>43</ID>
<ActivityID>35</ActivityID>
<MethodID>1</MethodID>
</_x0030_3m_ActivityMethods>
<_x0030_3m_ActivityMethods>
<ID>44</ID>
<ActivityID>16</ActivityID>
<MethodID>2</MethodID>
</_x0030_3m_ActivityMethods>
<_x0030_3m_ActivityMethods>
<ID>45</ID>
<ActivityID>16</ActivityID>
<MethodID>4</MethodID>
</_x0030_3m_ActivityMethods>
<_x0030_3m_ActivityMethods>
<ID>46</ID>
<ActivityID>16</ActivityID>
<MethodID>1</MethodID>
</_x0030_3m_ActivityMethods>
<_x0030_3m_ActivityMethods>
<ID>47</ID>
<ActivityID>16</ActivityID>
<MethodID>3</MethodID>
</_x0030_3m_ActivityMethods>
<_x0030_3m_ActivityMethods>
<ID>48</ID>
<ActivityID>35</ActivityID>
<MethodID>2</MethodID>
</_x0030_3m_ActivityMethods>
<_x0030_3m_ActivityMethods>
<ID>49</ID>
<ActivityID>35</ActivityID>
<MethodID>3</MethodID>
</_x0030_3m_ActivityMethods>
<_x0030_3m_ActivityMethods>
<ID>50</ID>
<ActivityID>37</ActivityID>
<MethodID>1</MethodID>
</_x0030_3m_ActivityMethods>
<_x0030_3m_ActivityMethods>
<ID>51</ID>
<ActivityID>37</ActivityID>
<MethodID>2</MethodID>
</_x0030_3m_ActivityMethods>
<_x0030_3m_ActivityMethods>
<ID>52</ID>
<ActivityID>37</ActivityID>
<MethodID>3</MethodID>
</_x0030_3m_ActivityMethods>
<_x0030_3m_ActivityMethods>
<ID>53</ID>
<ActivityID>37</ActivityID>
<MethodID>5</MethodID>
</_x0030_3m_ActivityMethods>
<_x0030_3m_ActivityMethods>
<ID>54</ID>
<ActivityID>36</ActivityID>
<MethodID>1</MethodID>
</_x0030_3m_ActivityMethods>
<_x0030_3m_ActivityMethods>
<ID>55</ID>
<ActivityID>36</ActivityID>
<MethodID>2</MethodID>
</_x0030_3m_ActivityMethods>
<_x0030_3m_ActivityMethods>
<ID>56</ID>
<ActivityID>36</ActivityID>
<MethodID>3</MethodID>
</_x0030_3m_ActivityMethods>
<_x0030_3m_ActivityMethods>
<ID>57</ID>
<ActivityID>36</ActivityID>
<MethodID>5</MethodID>
</_x0030_3m_ActivityMethods>
<_x0030_3m_ActivityMethods>
<ID>58</ID>
<ActivityID>38</ActivityID>
<MethodID>1</MethodID>
</_x0030_3m_ActivityMethods>
<_x0030_3m_ActivityMethods>
<ID>59</ID>
<ActivityID>38</ActivityID>
<MethodID>2</MethodID>
</_x0030_3m_ActivityMethods>
<_x0030_3m_ActivityMethods>
<ID>60</ID>
<ActivityID>38</ActivityID>
<MethodID>3</MethodID>
</_x0030_3m_ActivityMethods>
<_x0030_3m_ActivityMethods>
<ID>61</ID>
<ActivityID>38</ActivityID>
<MethodID>5</MethodID>
</_x0030_3m_ActivityMethods>
<_x0030_3m_ActivityMethods>
<ID>62</ID>
<ActivityID>38</ActivityID>
<MethodID>4</MethodID>
</_x0030_3m_ActivityMethods>
<_x0030_3m_ActivityMethods>
<ID>63</ID>
<ActivityID>41</ActivityID>
<MethodID>1</MethodID>
</_x0030_3m_ActivityMethods>
<_x0030_3m_ActivityMethods>
<ID>64</ID>
<ActivityID>41</ActivityID>
<MethodID>2</MethodID>
</_x0030_3m_ActivityMethods>
<_x0030_3m_ActivityMethods>
<ID>65</ID>
<ActivityID>41</ActivityID>
<MethodID>5</MethodID>
</_x0030_3m_ActivityMethods>
<_x0030_3m_ActivityMethods>
<ID>66</ID>
<ActivityID>40</ActivityID>
<MethodID>1</MethodID>
</_x0030_3m_ActivityMethods>
<_x0030_3m_ActivityMethods>
<ID>67</ID>
<ActivityID>40</ActivityID>
<MethodID>2</MethodID>
</_x0030_3m_ActivityMethods>
<_x0030_3m_ActivityMethods>
<ID>68</ID>
<ActivityID>40</ActivityID>
<MethodID>5</MethodID>
</_x0030_3m_ActivityMethods>
<_x0030_3m_ActivityMethods>
<ID>69</ID>
<ActivityID>45</ActivityID>
<MethodID>1</MethodID>
</_x0030_3m_ActivityMethods>
<_x0030_3m_ActivityMethods>
<ID>70</ID>
<ActivityID>45</ActivityID>
<MethodID>2</MethodID>
</_x0030_3m_ActivityMethods>
<_x0030_3m_ActivityMethods>
<ID>71</ID>
<ActivityID>45</ActivityID>
<MethodID>3</MethodID>
</_x0030_3m_ActivityMethods>
<_x0030_3m_ActivityMethods>
<ID>72</ID>
<ActivityID>45</ActivityID>
<MethodID>6</MethodID>
</_x0030_3m_ActivityMethods>
<_x0030_3m_ActivityMethods>
<ID>73</ID>
<ActivityID>45</ActivityID>
<MethodID>5</MethodID>
</_x0030_3m_ActivityMethods>
<_x0030_3m_ActivityMethods>
<ID>74</ID>
<ActivityID>44</ActivityID>
<MethodID>1</MethodID>
</_x0030_3m_ActivityMethods>
<_x0030_3m_ActivityMethods>
<ID>75</ID>
<ActivityID>44</ActivityID>
<MethodID>2</MethodID>
</_x0030_3m_ActivityMethods>
<_x0030_3m_ActivityMethods>
<ID>76</ID>
<ActivityID>44</ActivityID>
<MethodID>3</MethodID>
</_x0030_3m_ActivityMethods>
<_x0030_3m_ActivityMethods>
<ID>77</ID>
<ActivityID>44</ActivityID>
<MethodID>6</MethodID>
</_x0030_3m_ActivityMethods>
<_x0030_3m_ActivityMethods>
<ID>78</ID>
<ActivityID>44</ActivityID>
<MethodID>5</MethodID>
</_x0030_3m_ActivityMethods>
<_x0030_3m_ActivityMethods>
<ID>79</ID>
<ActivityID>47</ActivityID>
<MethodID>1</MethodID>
</_x0030_3m_ActivityMethods>
<_x0030_3m_ActivityMethods>
<ID>80</ID>
<ActivityID>47</ActivityID>